product_id,product_name,description,price,discount_percentage,category,brand,stock_quantity,color,size,weight,dimensions,release_date,rating,reviews_count,seller_name,seller_rating,seller_reviews_count,shipping_method,shipping_cost
250,nisi vulputate nonummy maecenas tincidunt lacus at velit vivamus vel nulla eget eros elementum,"Nulla neque libero, convallis eget, eleifend luctus, ultricies eu, nibh. Quisque id justo sit amet sapien dignissim vestibulum. Vestibulum ante ipsum primis in faucibus orci luctus et ultrices posuere cubilia Curae; Nulla dapibus dolor vel est. Donec odio justo, sollicitudin ut, suscipit a, feugiat et, eros. Vestibulum ac est lacinia nisi venenatis tristique. Fusce congue, diam id ornare imperdiet, sapien urna pretium nisl, ut volutpat sapien arcu sed augue. Aliquam erat volutpat. In congue. Etiam justo.",922.76,41.02,beauty,ante ipsum primis in faucibus orci luctus et ultrices posuere cubilia curae donec pharetra magna vestibulum aliquet ultrices erat tortor,518,Goldenrod,small,2.8,justo maecenas rhoncus aliquam lacus morbi quis tortor id nulla ultrices aliquet maecenas leo odio condimentum id luctus nec,2014-03-31,2.2,948,in purus eu magna vulputate luctus cum sociis natoque penatibus et magnis dis parturient,3.9,474,express,33.83
251,in porttitor pede justo eu massa donec dapibus duis at velit eu est congue,"Nulla tellus. In sagittis dui vel nisl. Duis ac nibh. Fusce lacus purus, aliquet at, feugiat non, pretium quis, lectus. Suspendisse potenti. In eleifend quam a odio. In hac habitasse platea dictumst. Maecenas ut massa quis augue luctus tincidunt. Nulla mollis molestie lorem. Quisque ut erat.",682.34,28.65,clothing,quis justo maecenas rhoncus aliquam lacus morbi quis tortor id nulla ultrices aliquet maecenas leo,764,Khaki,small,4.5,nibh fusce lacus purus aliquet at feugiat non pretium quis lectus suspendisse potenti in eleifend quam a,2012-06-17,1.5,845,porttitor lacus at turpis donec posuere metus vitae ipsum aliquam non mauris morbi non lectus aliquam sit amet diam,2.8,470,express,22.35
252,volutpat quam pede lobortis ligula sit amet eleifend pede libero quis orci nullam molestie nibh in,"Quisque porta volutpat erat. Quisque erat eros, viverra eget, congue eget, semper rutrum, nulla. Nunc purus. Phasellus in felis. Donec semper sapien a libero. Nam dui. Proin leo odio, porttitor id, consequat in, consequat ut, nulla. Sed accumsan felis. Ut at dolor quis odio consequat varius.",838.6,49.81,toys,eu mi nulla ac enim in tempor turpis nec euismod scelerisque quam turpis,371,Puce,extra large,9.8,nulla ac enim in tempor turpis nec euismod scelerisque quam turpis adipiscing lorem,2018-01-18,4.4,992,in faucibus orci luctus et ultrices posuere cubilia curae donec pharetra magna vestibulum,3.8,24,standard,7.3
253,nibh fusce lacus purus aliquet at feugiat non pretium quis lectus suspendisse potenti in eleifend,"Vestibulum ante ipsum primis in faucibus orci luctus et ultrices posuere cubilia Curae; Nulla dapibus dolor vel est. Donec odio justo, sollicitudin ut, suscipit a, feugiat et, eros. Vestibulum ac est lacinia nisi venenatis tristique. Fusce congue, diam id ornare imperdiet, sapien urna pretium nisl, ut volutpat sapien arcu sed augue. Aliquam erat volutpat.",887.27,33.52,beauty,aenean sit amet justo morbi ut odio cras mi pede malesuada in imperdiet et commodo,525,Maroon,extra large,3.3,amet consectetuer adipiscing elit proin interdum mauris non ligula pellentesque ultrices phasellus id sapien in sapien iaculis congue vivamus,2018-11-01,4.1,519,amet eros suspendisse accumsan tortor quis turpis sed ante vivamus tortor,2.8,553,express,6.95
254,dui maecenas tristique est et tempus semper est quam pharetra magna ac consequat metus sapien ut nunc vestibulum,Vestibulum ante ipsum primis in faucibus orci luctus et ultrices posuere cubilia Curae; Mauris viverra diam vitae quam. Suspendisse potenti. Nullam porttitor lacus at turpis. Donec posuere metus vitae ipsum. Aliquam non mauris. Morbi non lectus.,816.47,9.39,clothing,pellentesque quisque porta volutpat erat quisque erat eros viverra eget congue eget semper,961,Pink,medium,4.9,quam pede lobortis ligula sit amet eleifend pede libero quis orci,2019-05-29,2.7,192,pede malesuada in imperdiet et commodo vulputate justo in blandit ultrices enim lorem,4.0,476,standard,4.29
255,quam pede lobortis ligula sit amet eleifend pede libero quis orci nullam molestie nibh in lectus pellentesque at,"Donec ut dolor. Morbi vel lectus in quam fringilla rhoncus. Mauris enim leo, rhoncus sed, vestibulum sit amet, cursus id, turpis. Integer aliquet, massa id lobortis convallis, tortor risus dapibus augue, vel accumsan tellus nisi eu orci. Mauris lacinia sapien quis libero. Nullam sit amet turpis elementum ligula vehicula consequat.",565.54,15.77,beauty,morbi odio odio elementum eu interdum eu tincidunt in leo maecenas pulvinar lobortis est phasellus sit amet erat,662,Crimson,small,2.3,fringilla rhoncus mauris enim leo rhoncus sed vestibulum sit amet cursus id turpis,2013-11-20,2.6,881,non pretium quis lectus suspendisse potenti in eleifend quam a odio in,5.0,247,express,3.4
256,eleifend donec ut dolor morbi vel lectus in quam fringilla rhoncus mauris enim leo,"Nam congue, risus semper porta volutpat, quam pede lobortis ligula, sit amet eleifend pede libero quis orci. Nullam molestie nibh in lectus. Pellentesque at nulla. Suspendisse potenti. Cras in purus eu magna vulputate luctus. Cum sociis natoque penatibus et magnis dis parturient montes, nascetur ridiculus mus. Vivamus vestibulum sagittis sapien.",313.77,33.12,home decor,sit amet consectetuer adipiscing elit proin risus praesent lectus vestibulum quam sapien varius ut blandit,195,Blue,medium,4.0,quis lectus suspendisse potenti in eleifend quam a odio in hac habitasse platea,2019-03-21,4.2,386,volutpat erat quisque erat eros viverra eget congue eget semper rutrum nulla nunc purus phasellus,5.0,877,standard,11.3
257,erat curabitur gravida nisi at nibh in hac habitasse platea dictumst aliquam augue quam sollicitudin,Nulla justo. Aliquam quis turpis eget elit sodales scelerisque. Mauris sit amet eros. Suspendisse accumsan tortor quis turpis. Sed ante. Vivamus tortor.,884.22,25.5,toys,justo pellentesque viverra pede ac diam cras pellentesque volutpat dui,32,Teal,medium,7.5,sem praesent id massa id nisl venenatis lacinia aenean sit,2017-10-02,1.4,928,volutpat eleifend donec ut dolor morbi vel lectus in quam fringilla rhoncus mauris enim leo rhoncus,3.1,91,free,32.31
258,integer non velit donec diam neque vestibulum eget vulputate ut ultrices vel augue vestibulum ante ipsum,"In sagittis dui vel nisl. Duis ac nibh. Fusce lacus purus, aliquet at, feugiat non, pretium quis, lectus. Suspendisse potenti. In eleifend quam a odio. In hac habitasse platea dictumst. Maecenas ut massa quis augue luctus tincidunt. Nulla mollis molestie lorem. Quisque ut erat. Curabitur gravida nisi at nibh.",440.14,6.02,beauty,amet erat nulla tempus vivamus in felis eu sapien cursus vestibulum proin eu mi,438,Crimson,extra large,2.5,integer a nibh in quis justo maecenas rhoncus aliquam lacus morbi,2014-08-04,3.7,527,nisi venenatis tristique fusce congue diam id ornare imperdiet sapien urna pretium nisl ut,2.2,291,express,20.64
259,fermentum justo nec condimentum neque sapien placerat ante nulla justo,"Nullam orci pede, venenatis non, sodales sed, tincidunt eu, felis. Fusce posuere felis sed lacus.",504.73,44.11,electronics,phasellus in felis donec semper sapien a libero nam dui proin,595,Turquoise,medium,3.4,a suscipit nulla elit ac nulla sed vel enim sit amet nunc,2020-06-07,4.1,563,sapien urna pretium nisl ut volutpat sapien arcu sed augue aliquam erat volutpat in congue etiam justo etiam,3.9,584,standard,13.18
260,venenatis lacinia aenean sit amet justo morbi ut odio cras mi pede malesuada in imperdiet et,"Morbi ut odio. Cras mi pede, malesuada in, imperdiet et, commodo vulputate, justo. In blandit ultrices enim. Lorem ipsum dolor sit amet, consectetuer adipiscing elit. Proin interdum mauris non ligula pellentesque ultrices. Phasellus id sapien in sapien iaculis congue. Vivamus metus arcu, adipiscing molestie, hendrerit at, vulputate vitae, nisl. Aenean lectus. Pellentesque eget nunc. Donec quis orci eget orci vehicula condimentum.",151.59,39.05,home decor,nulla quisque arcu libero rutrum ac lobortis vel dapibus at diam,548,Puce,small,7.0,eget tempus vel pede morbi porttitor lorem id ligula suspendisse ornare,2016-01-23,2.3,259,velit vivamus vel nulla eget eros elementum pellentesque quisque porta volutpat erat quisque erat eros viverra,1.1,705,express,31.82
261,blandit ultrices enim lorem ipsum dolor sit amet consectetuer adipiscing elit proin interdum mauris,Donec vitae nisi.,29.59,46.88,electronics,tempor turpis nec euismod scelerisque quam turpis adipiscing lorem vitae mattis nibh ligula nec sem,979,Goldenrod,extra large,2.5,eget tempus vel pede morbi porttitor lorem id ligula suspendisse,2017-07-27,2.9,610,rutrum nulla nunc purus phasellus in felis donec semper sapien,4.7,13,standard,13.67
262,ac leo pellentesque ultrices mattis odio donec vitae nisi nam,"Duis consequat dui nec nisi volutpat eleifend. Donec ut dolor. Morbi vel lectus in quam fringilla rhoncus. Mauris enim leo, rhoncus sed, vestibulum sit amet, cursus id, turpis. Integer aliquet, massa id lobortis convallis, tortor risus dapibus augue, vel accumsan tellus nisi eu orci. Mauris lacinia sapien quis libero. Nullam sit amet turpis elementum ligula vehicula consequat.",365.18,30.06,beauty,nunc commodo placerat praesent blandit nam nulla integer pede justo lacinia,840,Aquamarine,extra large,0.4,quis lectus suspendisse potenti in eleifend quam a odio in,2012-08-13,4.3,815,lorem id ligula suspendisse ornare consequat lectus in est risus auctor,3.1,319,standard,43.68
263,potenti in eleifend quam a odio in hac habitasse platea dictumst maecenas ut massa quis augue luctus,Duis consequat dui nec nisi volutpat eleifend. Donec ut dolor. Morbi vel lectus in quam fringilla rhoncus.,425.7,38.58,clothing,massa tempor convallis nulla neque libero convallis eget eleifend luctus ultricies eu nibh quisque id justo sit,174,Orange,large,4.0,lectus pellentesque at nulla suspendisse potenti cras in purus eu magna vulputate luctus cum sociis natoque penatibus et magnis dis,2014-03-25,1.1,831,accumsan odio curabitur convallis duis consequat dui nec nisi volutpat,1.7,205,standard,15.02
264,blandit lacinia erat vestibulum sed magna at nunc commodo placerat praesent,In eleifend quam a odio. In hac habitasse platea dictumst. Maecenas ut massa quis augue luctus tincidunt. Nulla mollis molestie lorem. Quisque ut erat.,453.78,19.46,electronics,dictumst maecenas ut massa quis augue luctus tincidunt nulla mollis molestie lorem quisque ut erat curabitur,545,Purple,small,2.7,phasellus sit amet erat nulla tempus vivamus in felis eu sapien cursus vestibulum proin eu mi nulla ac,2020-05-23,3.5,928,lectus suspendisse potenti in eleifend quam a odio in hac,2.2,65,express,42.36
265,sed lacus morbi sem mauris laoreet ut rhoncus aliquet pulvinar sed nisl nunc rhoncus dui vel sem sed sagittis nam,"Duis at velit eu est congue elementum. In hac habitasse platea dictumst. Morbi vestibulum, velit id pretium iaculis, diam erat fermentum justo, nec condimentum neque sapien placerat ante.",723.59,11.0,clothing,pulvinar lobortis est phasellus sit amet erat nulla tempus vivamus,18,Green,medium,1.8,tortor sollicitudin mi sit amet lobortis sapien sapien non mi integer ac neque duis bibendum morbi non quam,2018-07-25,2.6,161,tincidunt ante vel ipsum praesent blandit lacinia erat vestibulum sed magna at nunc commodo placerat praesent blandit,4.1,264,free,0.24
266,diam cras pellentesque volutpat dui maecenas tristique est et tempus semper est quam,"Vestibulum ante ipsum primis in faucibus orci luctus et ultrices posuere cubilia Curae; Donec pharetra, magna vestibulum aliquet ultrices, erat tortor sollicitudin mi, sit amet lobortis sapien sapien non mi. Integer ac neque. Duis bibendum. Morbi non quam nec dui luctus rutrum. Nulla tellus.",771.57,3.57,clothing,parturient montes nascetur ridiculus mus etiam vel augue vestibulum rutrum,17,Teal,large,4.2,libero nam dui proin leo odio porttitor id consequat in consequat ut nulla sed accumsan felis ut at,2013-10-08,1.1,425,libero convallis eget eleifend luctus ultricies eu nibh quisque id,2.6,659,express,49.14
267,augue vel accumsan tellus nisi eu orci mauris lacinia sapien quis libero nullam sit amet,"Donec ut dolor. Morbi vel lectus in quam fringilla rhoncus. Mauris enim leo, rhoncus sed, vestibulum sit amet, cursus id, turpis. Integer aliquet, massa id lobortis convallis, tortor risus dapibus augue, vel accumsan tellus nisi eu orci.",637.96,44.34,beauty,enim blandit mi in porttitor pede justo eu massa donec dapibus duis at velit eu est congue elementum in,906,Purple,extra large,9.4,posuere cubilia curae nulla dapibus dolor vel est donec odio justo sollicitudin ut suscipit a feugiat et,2014-05-24,2.6,0,montes nascetur ridiculus mus vivamus vestibulum sagittis sapien cum sociis natoque penatibus,2.4,686,free,47.74
268,id mauris vulputate elementum nullam varius nulla facilisi cras non,Vivamus vel nulla eget eros elementum pellentesque.,753.39,47.4,clothing,nulla sed accumsan felis ut at dolor quis odio consequat varius integer ac leo pellentesque,513,Fuscia,medium,3.8,eget eros elementum pellentesque quisque porta volutpat erat quisque erat,2011-02-13,1.1,835,maecenas pulvinar lobortis est phasellus sit amet erat nulla tempus vivamus in felis eu sapien cursus vestibulum proin eu,3.3,866,standard,11.87
269,elementum in hac habitasse platea dictumst morbi vestibulum velit id pretium,Maecenas pulvinar lobortis est. Phasellus sit amet erat. Nulla tempus.,199.1,5.44,toys,sagittis dui vel nisl duis ac nibh fusce lacus purus aliquet at feugiat non pretium quis lectus suspendisse,9,Pink,large,5.1,neque vestibulum eget vulputate ut ultrices vel augue vestibulum ante ipsum primis in,2014-06-17,4.5,883,diam in magna bibendum imperdiet nullam orci pede venenatis non sodales sed,5.0,372,standard,14.47
270,molestie nibh in lectus pellentesque at nulla suspendisse potenti cras in purus eu magna vulputate luctus cum sociis natoque penatibus,"Duis consequat dui nec nisi volutpat eleifend. Donec ut dolor. Morbi vel lectus in quam fringilla rhoncus. Mauris enim leo, rhoncus sed, vestibulum sit amet, cursus id, turpis.",625.27,49.69,beauty,eget tincidunt eget tempus vel pede morbi porttitor lorem id ligula suspendisse ornare consequat lectus in est risus auctor sed,662,Mauv,large,9.4,amet cursus id turpis integer aliquet massa id lobortis convallis tortor risus dapibus augue vel accumsan tellus nisi eu orci,2021-11-04,2.9,46,pede ac diam cras pellentesque volutpat dui maecenas tristique est,1.2,568,free,48.18
271,vestibulum velit id pretium iaculis diam erat fermentum justo nec condimentum neque,"Pellentesque viverra pede ac diam. Cras pellentesque volutpat dui. Maecenas tristique, est et tempus semper, est quam pharetra magna, ac consequat metus sapien ut nunc. Vestibulum ante ipsum primis in faucibus orci luctus et ultrices posuere cubilia Curae; Mauris viverra diam vitae quam. Suspendisse potenti. Nullam porttitor lacus at turpis. Donec posuere metus vitae ipsum.",156.3,10.97,home decor,at feugiat non pretium quis lectus suspendisse potenti in eleifend,805,Crimson,large,9.9,ligula pellentesque ultrices phasellus id sapien in sapien iaculis congue vivamus metus arcu adipiscing molestie hendrerit at vulputate vitae nisl,2015-07-17,3.5,847,iaculis diam erat fermentum justo nec condimentum neque sapien placerat ante nulla justo aliquam quis turpis,2.8,713,free,8.72
272,non interdum in ante vestibulum ante ipsum primis in faucibus orci luctus et ultrices,"Vivamus vestibulum sagittis sapien. Cum sociis natoque penatibus et magnis dis parturient montes, nascetur ridiculus mus. Etiam vel augue. Vestibulum rutrum rutrum neque. Aenean auctor gravida sem. Praesent id massa id nisl venenatis lacinia. Aenean sit amet justo. Morbi ut odio.",242.46,38.2,beauty,morbi quis tortor id nulla ultrices aliquet maecenas leo odio,337,Puce,small,1.6,vulputate justo in blandit ultrices enim lorem ipsum dolor sit amet consectetuer,2019-07-02,3.5,290,aliquet pulvinar sed nisl nunc rhoncus dui vel sem sed sagittis nam congue risus,4.0,40,standard,29.45
273,non pretium quis lectus suspendisse potenti in eleifend quam a odio,"Donec semper sapien a libero. Nam dui. Proin leo odio, porttitor id, consequat in, consequat ut, nulla. Sed accumsan felis. Ut at dolor quis odio consequat varius. Integer ac leo.",959.4,13.06,electronics,luctus nec molestie sed justo pellentesque viverra pede ac diam cras,911,Khaki,large,0.3,quisque arcu libero rutrum ac lobortis vel dapibus at diam nam tristique tortor eu,2010-05-03,3.9,229,pulvinar lobortis est phasellus sit amet erat nulla tempus vivamus in felis eu sapien cursus,4.4,361,free,30.16
274,fusce consequat nulla nisl nunc nisl duis bibendum felis sed interdum venenatis,Quisque ut erat. Curabitur gravida nisi at nibh. In hac habitasse platea dictumst.,126.9,49.58,electronics,lacus curabitur at ipsum ac tellus semper interdum mauris ullamcorper purus sit amet nulla quisque arcu libero,755,Indigo,extra large,7.6,volutpat in congue etiam justo etiam pretium iaculis justo in hac habitasse platea dictumst etiam faucibus cursus urna ut,2017-08-08,3.4,671,elit proin interdum mauris non ligula pellentesque ultrices phasellus id sapien,1.6,802,express,33.88
275,ante ipsum primis in faucibus orci luctus et ultrices posuere cubilia curae,"Praesent blandit. Nam nulla. Integer pede justo, lacinia eget, tincidunt eget, tempus vel, pede.",384.72,31.6,electronics,bibendum imperdiet nullam orci pede venenatis non sodales sed tincidunt eu felis fusce,406,Maroon,small,1.2,quam sapien varius ut blandit non interdum in ante vestibulum ante ipsum primis in faucibus orci luctus,2017-10-01,4.3,252,vulputate elementum nullam varius nulla facilisi cras non velit nec nisi vulputate nonummy maecenas tincidunt,2.4,481,standard,6.76
276,posuere felis sed lacus morbi sem mauris laoreet ut rhoncus aliquet pulvinar sed,"Nam ultrices, libero non mattis pulvinar, nulla pede ullamcorper augue, a suscipit nulla elit ac nulla. Sed vel enim sit amet nunc viverra dapibus. Nulla suscipit ligula in lacus. Curabitur at ipsum ac tellus semper interdum. Mauris ullamcorper purus sit amet nulla. Quisque arcu libero, rutrum ac, lobortis vel, dapibus at, diam. Nam tristique tortor eu pede.",219.99,23.35,toys,metus sapien ut nunc vestibulum ante ipsum primis in faucibus orci luctus et ultrices posuere,579,Yellow,large,4.8,tincidunt in leo maecenas pulvinar lobortis est phasellus sit amet erat nulla tempus,2011-12-26,1.5,828,enim blandit mi in porttitor pede justo eu massa donec dapibus duis,1.2,250,free,3.27
277,penatibus et magnis dis parturient montes nascetur ridiculus mus etiam vel augue vestibulum rutrum rutrum neque aenean auctor,Nunc purus.,970.88,42.9,beauty,sit amet nulla quisque arcu libero rutrum ac lobortis vel dapibus at diam nam tristique,522,Aquamarine,large,7.5,aenean auctor gravida sem praesent id massa id nisl venenatis lacinia aenean sit amet justo morbi,2019-09-27,4.8,181,in felis donec semper sapien a libero nam dui proin leo odio porttitor id consequat in consequat ut nulla,1.7,940,free,29.11
278,tempus sit amet sem fusce consequat nulla nisl nunc nisl duis bibendum felis,"Integer a nibh. In quis justo. Maecenas rhoncus aliquam lacus. Morbi quis tortor id nulla ultrices aliquet. Maecenas leo odio, condimentum id, luctus nec, molestie sed, justo. Pellentesque viverra pede ac diam. Cras pellentesque volutpat dui. Maecenas tristique, est et tempus semper, est quam pharetra magna, ac consequat metus sapien ut nunc. Vestibulum ante ipsum primis in faucibus orci luctus et ultrices posuere cubilia Curae; Mauris viverra diam vitae quam. Suspendisse potenti.",443.51,23.01,toys,nunc vestibulum ante ipsum primis in faucibus orci luctus et ultrices posuere cubilia curae mauris viverra diam vitae quam,826,Orange,small,2.2,aenean auctor gravida sem praesent id massa id nisl venenatis lacinia aenean,2014-09-27,2.0,966,habitasse platea dictumst morbi vestibulum velit id pretium iaculis diam erat fermentum justo nec condimentum neque sapien placerat ante nulla,2.5,702,express,29.08
279,id luctus nec molestie sed justo pellentesque viverra pede ac diam,Nulla ut erat id mauris vulputate elementum.,100.61,32.96,clothing,nonummy maecenas tincidunt lacus at velit vivamus vel nulla eget eros,71,Violet,extra large,1.6,porttitor lorem id ligula suspendisse ornare consequat lectus in est risus,2010-05-29,4.8,187,sem fusce consequat nulla nisl nunc nisl duis bibendum felis sed interdum venenatis turpis enim blandit mi in,4.7,11,free,14.56
280,mauris sit amet eros suspendisse accumsan tortor quis turpis sed ante vivamus tortor duis mattis egestas metus aenean fermentum,"Nam congue, risus semper porta volutpat, quam pede lobortis ligula, sit amet eleifend pede libero quis orci. Nullam molestie nibh in lectus.",58.67,19.71,beauty,integer ac neque duis bibendum morbi non quam nec dui,930,Teal,extra large,1.7,nisl duis ac nibh fusce lacus purus aliquet at feugiat non pretium quis lectus,2017-06-29,4.6,136,duis aliquam convallis nunc proin at turpis a pede posuere nonummy integer non velit donec,2.9,231,free,24.46
281,pulvinar nulla pede ullamcorper augue a suscipit nulla elit ac nulla sed vel enim,"Fusce posuere felis sed lacus. Morbi sem mauris, laoreet ut, rhoncus aliquet, pulvinar sed, nisl.",879.65,42.17,electronics,nulla pede ullamcorper augue a suscipit nulla elit ac nulla sed vel enim sit amet nunc viverra dapibus nulla,929,Violet,small,1.9,rutrum nulla nunc purus phasellus in felis donec semper sapien a,2020-08-08,2.2,661,morbi non quam nec dui luctus rutrum nulla tellus in sagittis dui,1.7,169,free,4.12
282,pede ullamcorper augue a suscipit nulla elit ac nulla sed vel enim sit amet nunc viverra dapibus nulla,Nulla ut erat id mauris vulputate elementum. Nullam varius. Nulla facilisi. Cras non velit nec nisi vulputate nonummy.,94.95,20.26,clothing,amet eros suspendisse accumsan tortor quis turpis sed ante vivamus tortor duis mattis egestas metus aenean fermentum donec ut,927,Purple,medium,4.4,duis faucibus accumsan odio curabitur convallis duis consequat dui nec nisi volutpat eleifend,2012-11-05,1.7,237,non mattis pulvinar nulla pede ullamcorper augue a suscipit nulla elit ac,1.7,169,standard,48.93
283,vestibulum sed magna at nunc commodo placerat praesent blandit nam,"Praesent blandit lacinia erat. Vestibulum sed magna at nunc commodo placerat. Praesent blandit. Nam nulla. Integer pede justo, lacinia eget, tincidunt eget, tempus vel, pede. Morbi porttitor lorem id ligula. Suspendisse ornare consequat lectus. In est risus, auctor sed, tristique in, tempus sit amet, sem.",836.61,41.93,clothing,commodo vulputate justo in blandit ultrices enim lorem ipsum dolor sit amet consectetuer adipiscing elit proin interdum mauris non ligula,889,Yellow,large,8.1,porta volutpat quam pede lobortis ligula sit amet eleifend pede libero quis orci nullam,2020-07-25,2.7,687,lectus vestibulum quam sapien varius ut blandit non interdum in ante vestibulum,1.5,547,free,24.81
284,aliquam augue quam sollicitudin vitae consectetuer eget rutrum at lorem integer tincidunt ante vel ipsum praesent blandit lacinia,"Duis mattis egestas metus. Aenean fermentum. Donec ut mauris eget massa tempor convallis. Nulla neque libero, convallis eget, eleifend luctus, ultricies eu, nibh. Quisque id justo sit amet sapien dignissim vestibulum. Vestibulum ante ipsum primis in faucibus orci luctus et ultrices posuere cubilia Curae; Nulla dapibus dolor vel est. Donec odio justo, sollicitudin ut, suscipit a, feugiat et, eros. Vestibulum ac est lacinia nisi venenatis tristique.",439.82,43.1,toys,consequat metus sapien ut nunc vestibulum ante ipsum primis in faucibus,634,Teal,large,8.6,semper porta volutpat quam pede lobortis ligula sit amet eleifend,2016-07-12,3.0,492,purus aliquet at feugiat non pretium quis lectus suspendisse potenti in eleifend quam a odio in hac habitasse platea dictumst,4.3,17,standard,25.97
285,vestibulum aliquet ultrices erat tortor sollicitudin mi sit amet lobortis sapien sapien,Vestibulum rutrum rutrum neque. Aenean auctor gravida sem. Praesent id massa id nisl venenatis lacinia.,718.98,34.89,clothing,vulputate luctus cum sociis natoque penatibus et magnis dis parturient montes nascetur ridiculus mus vivamus,330,Puce,extra large,6.7,vestibulum eget vulputate ut ultrices vel augue vestibulum ante ipsum primis in,2019-06-01,3.4,456,bibendum morbi non quam nec dui luctus rutrum nulla tellus in sagittis dui vel nisl duis ac nibh,2.7,171,express,25.21
286,orci vehicula condimentum curabitur in libero ut massa volutpat convallis morbi odio odio elementum eu interdum eu tincidunt,"Morbi vel lectus in quam fringilla rhoncus. Mauris enim leo, rhoncus sed, vestibulum sit amet, cursus id, turpis. Integer aliquet, massa id lobortis convallis, tortor risus dapibus augue, vel accumsan tellus nisi eu orci. Mauris lacinia sapien quis libero.",944.75,33.78,home decor,urna pretium nisl ut volutpat sapien arcu sed augue aliquam erat volutpat in congue,284,Crimson,medium,3.9,eu felis fusce posuere felis sed lacus morbi sem mauris laoreet ut rhoncus aliquet pulvinar sed nisl,2018-05-17,4.0,904,ipsum primis in faucibus orci luctus et ultrices posuere cubilia curae mauris viverra diam vitae quam suspendisse potenti nullam porttitor,1.8,493,free,12.25
