product_id,product_name,description,price,discount_percentage,category,brand,stock_quantity,color,size,weight,dimensions,release_date,rating,reviews_count,seller_name,seller_rating,seller_reviews_count,shipping_method,shipping_cost
749,nam dui proin leo odio porttitor id consequat in consequat ut nulla sed accumsan,"Lorem ipsum dolor sit amet, consectetuer adipiscing elit. Proin risus. Praesent lectus. Vestibulum quam sapien, varius ut, blandit non, interdum in, ante. Vestibulum ante ipsum primis in faucibus orci luctus et ultrices posuere cubilia Curae; Duis faucibus accumsan odio. Curabitur convallis.",667.67,2.38,beauty,sapien dignissim vestibulum vestibulum ante ipsum primis in faucibus orci luctus et,214,Mauv,small,9.5,nunc purus phasellus in felis donec semper sapien a libero nam dui proin,2011-04-09,4.9,970,semper rutrum nulla nunc purus phasellus in felis donec semper sapien a libero nam dui proin leo odio porttitor,3.6,677,free,11.21
750,blandit non interdum in ante vestibulum ante ipsum primis in faucibus orci,"Fusce congue, diam id ornare imperdiet, sapien urna pretium nisl, ut volutpat sapien arcu sed augue. Aliquam erat volutpat.",168.16,31.92,clothing,in imperdiet et commodo vulputate justo in blandit ultrices enim lorem,661,Mauv,medium,3.5,libero nam dui proin leo odio porttitor id consequat in consequat ut nulla sed accumsan felis ut at dolor,2019-08-05,4.0,370,primis in faucibus orci luctus et ultrices posuere cubilia curae nulla dapibus dolor vel,3.9,787,express,48.69
751,eleifend quam a odio in hac habitasse platea dictumst maecenas ut massa quis,"Quisque ut erat. Curabitur gravida nisi at nibh. In hac habitasse platea dictumst. Aliquam augue quam, sollicitudin vitae, consectetuer eget, rutrum at, lorem. Integer tincidunt ante vel ipsum. Praesent blandit lacinia erat. Vestibulum sed magna at nunc commodo placerat.",221.68,32.39,electronics,semper est quam pharetra magna ac consequat metus sapien ut nunc vestibulum ante ipsum primis in faucibus orci,423,Aquamarine,medium,1.8,nulla neque libero convallis eget eleifend luctus ultricies eu nibh,2013-07-05,4.4,557,ut erat curabitur gravida nisi at nibh in hac habitasse platea dictumst aliquam augue quam sollicitudin vitae,3.6,681,express,43.92
752,cubilia curae duis faucibus accumsan odio curabitur convallis duis consequat dui nec nisi volutpat eleifend donec ut dolor,"Quisque id justo sit amet sapien dignissim vestibulum. Vestibulum ante ipsum primis in faucibus orci luctus et ultrices posuere cubilia Curae; Nulla dapibus dolor vel est. Donec odio justo, sollicitudin ut, suscipit a, feugiat et, eros. Vestibulum ac est lacinia nisi venenatis tristique.",234.46,20.79,home decor,arcu adipiscing molestie hendrerit at vulputate vitae nisl aenean lectus pellentesque eget nunc donec quis orci,983,Goldenrod,large,6.0,pede morbi porttitor lorem id ligula suspendisse ornare consequat lectus in est risus auctor sed tristique in tempus,2016-01-02,4.0,704,habitasse platea dictumst etiam faucibus cursus urna ut tellus nulla ut,2.7,360,free,13.4
753,mi nulla ac enim in tempor turpis nec euismod scelerisque quam turpis adipiscing,"Lorem ipsum dolor sit amet, consectetuer adipiscing elit. Proin risus. Praesent lectus. Vestibulum quam sapien, varius ut, blandit non, interdum in, ante. Vestibulum ante ipsum primis in faucibus orci luctus et ultrices posuere cubilia Curae; Duis faucibus accumsan odio. Curabitur convallis. Duis consequat dui nec nisi volutpat eleifend. Donec ut dolor.",7.86,7.11,beauty,sapien dignissim vestibulum vestibulum ante ipsum primis in faucibus orci luctus et ultrices posuere cubilia curae,113,Puce,medium,8.5,magna at nunc commodo placerat praesent blandit nam nulla integer pede justo lacinia eget tincidunt eget tempus vel pede,2010-06-26,1.0,174,magna vestibulum aliquet ultrices erat tortor sollicitudin mi sit amet lobortis sapien sapien non mi integer ac neque,4.6,802,standard,22.84
754,lorem id ligula suspendisse ornare consequat lectus in est risus auctor sed tristique,"Cum sociis natoque penatibus et magnis dis parturient montes, nascetur ridiculus mus.",607.79,11.64,electronics,posuere cubilia curae nulla dapibus dolor vel est donec odio justo sollicitudin,683,Yellow,large,9.8,nulla sed accumsan felis ut at dolor quis odio consequat varius integer ac leo,2010-01-10,1.4,92,felis sed interdum venenatis turpis enim blandit mi in porttitor pede justo eu massa donec dapibus duis at velit,3.8,845,free,20.2
755,turpis nec euismod scelerisque quam turpis adipiscing lorem vitae mattis nibh ligula nec,"Mauris enim leo, rhoncus sed, vestibulum sit amet, cursus id, turpis. Integer aliquet, massa id lobortis convallis, tortor risus dapibus augue, vel accumsan tellus nisi eu orci. Mauris lacinia sapien quis libero. Nullam sit amet turpis elementum ligula vehicula consequat.",424.93,49.93,electronics,non velit nec nisi vulputate nonummy maecenas tincidunt lacus at velit vivamus vel nulla eget eros,800,Maroon,medium,2.1,nulla integer pede justo lacinia eget tincidunt eget tempus vel pede morbi porttitor lorem id ligula suspendisse ornare consequat,2022-07-17,4.4,976,felis sed interdum venenatis turpis enim blandit mi in porttitor pede justo,4.5,417,standard,21.01
756,urna ut tellus nulla ut erat id mauris vulputate elementum nullam varius nulla facilisi cras non velit nec nisi,"Ut at dolor quis odio consequat varius. Integer ac leo. Pellentesque ultrices mattis odio. Donec vitae nisi. Nam ultrices, libero non mattis pulvinar, nulla pede ullamcorper augue, a suscipit nulla elit ac nulla. Sed vel enim sit amet nunc viverra dapibus. Nulla suscipit ligula in lacus.",233.24,27.04,clothing,eu nibh quisque id justo sit amet sapien dignissim vestibulum vestibulum ante ipsum primis in faucibus orci luctus et,686,Aquamarine,extra large,3.6,quis turpis sed ante vivamus tortor duis mattis egestas metus aenean fermentum donec ut mauris eget,2016-02-07,4.8,729,fusce consequat nulla nisl nunc nisl duis bibendum felis sed,3.9,827,free,7.96
757,dapibus augue vel accumsan tellus nisi eu orci mauris lacinia sapien quis libero nullam sit amet turpis,"Integer aliquet, massa id lobortis convallis, tortor risus dapibus augue, vel accumsan tellus nisi eu orci.",965.41,4.46,beauty,quam nec dui luctus rutrum nulla tellus in sagittis dui vel nisl duis ac nibh fusce,330,Violet,extra large,7.6,faucibus orci luctus et ultrices posuere cubilia curae duis faucibus,2019-10-26,4.4,232,massa tempor convallis nulla neque libero convallis eget eleifend luctus ultricies eu nibh quisque id,4.4,530,free,1.55
758,est donec odio justo sollicitudin ut suscipit a feugiat et eros vestibulum,"Fusce posuere felis sed lacus. Morbi sem mauris, laoreet ut, rhoncus aliquet, pulvinar sed, nisl. Nunc rhoncus dui vel sem. Sed sagittis. Nam congue, risus semper porta volutpat, quam pede lobortis ligula, sit amet eleifend pede libero quis orci. Nullam molestie nibh in lectus. Pellentesque at nulla. Suspendisse potenti. Cras in purus eu magna vulputate luctus. Cum sociis natoque penatibus et magnis dis parturient montes, nascetur ridiculus mus.",152.13,41.19,electronics,morbi ut odio cras mi pede malesuada in imperdiet et commodo vulputate justo in blandit ultrices,41,Crimson,medium,3.8,nullam sit amet turpis elementum ligula vehicula consequat morbi a ipsum integer a nibh in,2014-04-06,2.0,977,aliquam sit amet diam in magna bibendum imperdiet nullam orci pede venenatis non sodales sed tincidunt,1.6,508,standard,45.69
759,praesent blandit lacinia erat vestibulum sed magna at nunc commodo placerat praesent blandit nam nulla integer,"Suspendisse accumsan tortor quis turpis. Sed ante. Vivamus tortor. Duis mattis egestas metus. Aenean fermentum. Donec ut mauris eget massa tempor convallis. Nulla neque libero, convallis eget, eleifend luctus, ultricies eu, nibh.",827.07,22.82,toys,nulla dapibus dolor vel est donec odio justo sollicitudin ut suscipit a feugiat et eros vestibulum ac,645,Indigo,small,8.7,pede justo eu massa donec dapibus duis at velit eu est congue,2018-05-06,3.0,474,mattis pulvinar nulla pede ullamcorper augue a suscipit nulla elit ac nulla sed vel enim sit amet nunc,1.4,518,free,10.93
760,lobortis ligula sit amet eleifend pede libero quis orci nullam molestie nibh in lectus pellentesque at nulla suspendisse potenti,"Proin leo odio, porttitor id, consequat in, consequat ut, nulla. Sed accumsan felis. Ut at dolor quis odio consequat varius. Integer ac leo. Pellentesque ultrices mattis odio. Donec vitae nisi. Nam ultrices, libero non mattis pulvinar, nulla pede ullamcorper augue, a suscipit nulla elit ac nulla. Sed vel enim sit amet nunc viverra dapibus.",664.35,17.99,home decor,porttitor id consequat in consequat ut nulla sed accumsan felis ut,263,Goldenrod,extra large,2.9,nunc donec quis orci eget orci vehicula condimentum curabitur in libero ut massa volutpat convallis morbi odio odio elementum,2013-10-07,1.1,156,id pretium iaculis diam erat fermentum justo nec condimentum neque sapien placerat ante,4.1,862,express,45.79
761,sollicitudin ut suscipit a feugiat et eros vestibulum ac est lacinia nisi venenatis tristique fusce congue diam,"Donec diam neque, vestibulum eget, vulputate ut, ultrices vel, augue. Vestibulum ante ipsum primis in faucibus orci luctus et ultrices posuere cubilia Curae; Donec pharetra, magna vestibulum aliquet ultrices, erat tortor sollicitudin mi, sit amet lobortis sapien sapien non mi. Integer ac neque. Duis bibendum. Morbi non quam nec dui luctus rutrum. Nulla tellus.",657.45,37.62,home decor,non mattis pulvinar nulla pede ullamcorper augue a suscipit nulla elit ac nulla,570,Teal,small,2.0,lobortis est phasellus sit amet erat nulla tempus vivamus in felis eu sapien cursus vestibulum,2012-12-11,1.3,984,quis turpis sed ante vivamus tortor duis mattis egestas metus aenean fermentum donec ut mauris,2.2,77,standard,12.66
762,viverra pede ac diam cras pellentesque volutpat dui maecenas tristique est et tempus semper est quam pharetra magna ac consequat,"Suspendisse potenti. Cras in purus eu magna vulputate luctus. Cum sociis natoque penatibus et magnis dis parturient montes, nascetur ridiculus mus. Vivamus vestibulum sagittis sapien. Cum sociis natoque penatibus et magnis dis parturient montes, nascetur ridiculus mus. Etiam vel augue.",203.29,46.09,beauty,felis sed lacus morbi sem mauris laoreet ut rhoncus aliquet pulvinar,350,Pink,small,6.3,convallis nulla neque libero convallis eget eleifend luctus ultricies eu nibh quisque id,2014-09-10,4.8,553,felis fusce posuere felis sed lacus morbi sem mauris laoreet ut rhoncus aliquet pulvinar sed,3.5,805,standard,31.29
763,duis consequat dui nec nisi volutpat eleifend donec ut dolor morbi vel lectus in quam fringilla rhoncus mauris enim,In hac habitasse platea dictumst.,124.71,20.66,clothing,rutrum neque aenean auctor gravida sem praesent id massa id nisl,586,Puce,small,2.1,ut suscipit a feugiat et eros vestibulum ac est lacinia nisi venenatis tristique fusce congue diam id,2019-04-21,1.1,580,in lectus pellentesque at nulla suspendisse potenti cras in purus eu magna vulputate luctus cum sociis,2.4,915,free,27.75
764,curabitur at ipsum ac tellus semper interdum mauris ullamcorper purus sit amet nulla,"Praesent blandit lacinia erat. Vestibulum sed magna at nunc commodo placerat. Praesent blandit. Nam nulla. Integer pede justo, lacinia eget, tincidunt eget, tempus vel, pede. Morbi porttitor lorem id ligula.",652.4,13.04,beauty,sapien cursus vestibulum proin eu mi nulla ac enim in tempor turpis nec euismod scelerisque,894,Pink,large,6.5,potenti in eleifend quam a odio in hac habitasse platea dictumst maecenas ut massa quis,2013-07-22,2.3,431,at turpis a pede posuere nonummy integer non velit donec,3.0,346,standard,12.63
765,turpis sed ante vivamus tortor duis mattis egestas metus aenean fermentum,"Nullam orci pede, venenatis non, sodales sed, tincidunt eu, felis. Fusce posuere felis sed lacus. Morbi sem mauris, laoreet ut, rhoncus aliquet, pulvinar sed, nisl. Nunc rhoncus dui vel sem. Sed sagittis.",551.56,45.76,electronics,et tempus semper est quam pharetra magna ac consequat metus sapien ut nunc vestibulum ante ipsum,320,Khaki,extra large,7.0,lectus vestibulum quam sapien varius ut blandit non interdum in ante vestibulum,2021-05-01,1.7,695,sed nisl nunc rhoncus dui vel sem sed sagittis nam congue risus semper porta,3.0,441,free,39.03
766,blandit nam nulla integer pede justo lacinia eget tincidunt eget tempus vel,"Phasellus in felis. Donec semper sapien a libero. Nam dui. Proin leo odio, porttitor id, consequat in, consequat ut, nulla. Sed accumsan felis.",231.72,36.48,home decor,gravida sem praesent id massa id nisl venenatis lacinia aenean sit amet justo morbi ut odio cras mi,376,Purple,medium,7.4,vulputate justo in blandit ultrices enim lorem ipsum dolor sit amet consectetuer adipiscing elit proin interdum mauris non ligula pellentesque,2014-05-29,2.3,148,nulla neque libero convallis eget eleifend luctus ultricies eu nibh quisque id justo sit amet sapien dignissim vestibulum vestibulum ante,3.9,85,standard,37.18
767,quis tortor id nulla ultrices aliquet maecenas leo odio condimentum id luctus nec molestie,Vestibulum ante ipsum primis in faucibus orci luctus et ultrices posuere cubilia Curae; Mauris viverra diam vitae quam. Suspendisse potenti.,436.02,48.09,beauty,etiam vel augue vestibulum rutrum rutrum neque aenean auctor gravida sem,832,Puce,small,7.7,rhoncus aliquet pulvinar sed nisl nunc rhoncus dui vel sem sed sagittis,2012-05-16,1.7,541,at nulla suspendisse potenti cras in purus eu magna vulputate luctus,4.3,576,express,48.13
768,natoque penatibus et magnis dis parturient montes nascetur ridiculus mus vivamus vestibulum sagittis,"Nam dui. Proin leo odio, porttitor id, consequat in, consequat ut, nulla. Sed accumsan felis. Ut at dolor quis odio consequat varius. Integer ac leo. Pellentesque ultrices mattis odio. Donec vitae nisi. Nam ultrices, libero non mattis pulvinar, nulla pede ullamcorper augue, a suscipit nulla elit ac nulla. Sed vel enim sit amet nunc viverra dapibus. Nulla suscipit ligula in lacus.",605.74,18.78,toys,nulla tempus vivamus in felis eu sapien cursus vestibulum proin eu mi nulla ac enim in,155,Turquoise,small,7.7,vel ipsum praesent blandit lacinia erat vestibulum sed magna at nunc commodo placerat praesent blandit nam nulla integer,2016-05-03,2.3,268,donec ut mauris eget massa tempor convallis nulla neque libero convallis eget,4.8,351,standard,41.42
769,at ipsum ac tellus semper interdum mauris ullamcorper purus sit amet nulla quisque arcu libero,Ut at dolor quis odio consequat varius. Integer ac leo.,909.07,8.26,electronics,nunc nisl duis bibendum felis sed interdum venenatis turpis enim blandit mi in porttitor pede justo eu massa donec,97,Turquoise,medium,1.0,sapien in sapien iaculis congue vivamus metus arcu adipiscing molestie hendrerit at vulputate vitae nisl aenean lectus pellentesque eget,2022-02-06,4.8,218,habitasse platea dictumst aliquam augue quam sollicitudin vitae consectetuer eget,3.7,798,express,2.0
770,lorem vitae mattis nibh ligula nec sem duis aliquam convallis nunc proin at turpis a pede posuere nonummy integer non,"Nulla nisl. Nunc nisl. Duis bibendum, felis sed interdum venenatis, turpis enim blandit mi, in porttitor pede justo eu massa. Donec dapibus. Duis at velit eu est congue elementum. In hac habitasse platea dictumst. Morbi vestibulum, velit id pretium iaculis, diam erat fermentum justo, nec condimentum neque sapien placerat ante. Nulla justo. Aliquam quis turpis eget elit sodales scelerisque.",366.74,15.78,clothing,molestie sed justo pellentesque viverra pede ac diam cras pellentesque volutpat dui maecenas tristique est et tempus,236,Crimson,extra large,5.5,ante vel ipsum praesent blandit lacinia erat vestibulum sed magna at nunc commodo,2011-11-02,2.8,171,dolor vel est donec odio justo sollicitudin ut suscipit a feugiat,4.0,883,standard,6.94
771,lectus suspendisse potenti in eleifend quam a odio in hac habitasse platea dictumst maecenas ut massa quis augue luctus tincidunt,"Duis bibendum, felis sed interdum venenatis, turpis enim blandit mi, in porttitor pede justo eu massa. Donec dapibus.",166.69,47.97,beauty,eu tincidunt in leo maecenas pulvinar lobortis est phasellus sit amet erat nulla tempus vivamus in felis eu,607,Crimson,medium,8.0,felis sed lacus morbi sem mauris laoreet ut rhoncus aliquet pulvinar sed,2012-09-29,4.3,535,massa volutpat convallis morbi odio odio elementum eu interdum eu tincidunt in leo,2.3,325,express,31.12
772,nulla nisl nunc nisl duis bibendum felis sed interdum venenatis turpis enim blandit mi in porttitor pede justo eu massa,"Nulla mollis molestie lorem. Quisque ut erat. Curabitur gravida nisi at nibh. In hac habitasse platea dictumst. Aliquam augue quam, sollicitudin vitae, consectetuer eget, rutrum at, lorem. Integer tincidunt ante vel ipsum. Praesent blandit lacinia erat.",894.69,14.64,home decor,mauris lacinia sapien quis libero nullam sit amet turpis elementum,72,Red,small,2.3,facilisi cras non velit nec nisi vulputate nonummy maecenas tincidunt lacus at velit,2013-03-05,1.2,511,curabitur convallis duis consequat dui nec nisi volutpat eleifend donec ut dolor morbi vel,2.3,733,free,9.17
773,ligula suspendisse ornare consequat lectus in est risus auctor sed tristique in tempus sit amet sem,Nullam sit amet turpis elementum ligula vehicula consequat. Morbi a ipsum. Integer a nibh.,26.88,11.84,electronics,sollicitudin ut suscipit a feugiat et eros vestibulum ac est lacinia nisi venenatis tristique fusce congue diam id ornare imperdiet,144,Fuscia,small,5.5,dui luctus rutrum nulla tellus in sagittis dui vel nisl,2020-06-30,3.7,791,lacinia nisi venenatis tristique fusce congue diam id ornare imperdiet sapien urna pretium nisl ut volutpat sapien arcu,4.6,182,standard,14.34
774,nonummy maecenas tincidunt lacus at velit vivamus vel nulla eget,Curabitur convallis. Duis consequat dui nec nisi volutpat eleifend. Donec ut dolor.,363.19,44.33,beauty,proin leo odio porttitor id consequat in consequat ut nulla sed accumsan,880,Yellow,small,0.5,in porttitor pede justo eu massa donec dapibus duis at velit eu est congue,2017-11-22,1.7,649,aliquam non mauris morbi non lectus aliquam sit amet diam in magna bibendum imperdiet nullam,2.6,705,free,25.54
775,enim in tempor turpis nec euismod scelerisque quam turpis adipiscing lorem vitae mattis nibh ligula nec sem,"In eleifend quam a odio. In hac habitasse platea dictumst. Maecenas ut massa quis augue luctus tincidunt. Nulla mollis molestie lorem. Quisque ut erat. Curabitur gravida nisi at nibh. In hac habitasse platea dictumst. Aliquam augue quam, sollicitudin vitae, consectetuer eget, rutrum at, lorem. Integer tincidunt ante vel ipsum.",492.8,11.43,home decor,nibh fusce lacus purus aliquet at feugiat non pretium quis lectus suspendisse potenti in,212,Khaki,medium,3.8,volutpat erat quisque erat eros viverra eget congue eget semper rutrum nulla,2015-01-16,2.1,928,vel nisl duis ac nibh fusce lacus purus aliquet at feugiat non pretium,3.7,528,express,27.93
776,sapien varius ut blandit non interdum in ante vestibulum ante ipsum primis in faucibus orci luctus et ultrices posuere,"Morbi sem mauris, laoreet ut, rhoncus aliquet, pulvinar sed, nisl. Nunc rhoncus dui vel sem. Sed sagittis. Nam congue, risus semper porta volutpat, quam pede lobortis ligula, sit amet eleifend pede libero quis orci. Nullam molestie nibh in lectus. Pellentesque at nulla. Suspendisse potenti. Cras in purus eu magna vulputate luctus. Cum sociis natoque penatibus et magnis dis parturient montes, nascetur ridiculus mus. Vivamus vestibulum sagittis sapien.",428.68,15.86,home decor,hac habitasse platea dictumst morbi vestibulum velit id pretium iaculis diam erat fermentum justo nec condimentum neque sapien placerat ante,515,Mauv,large,4.4,et ultrices posuere cubilia curae mauris viverra diam vitae quam suspendisse potenti nullam porttitor lacus at turpis,2011-04-29,1.1,900,quam turpis adipiscing lorem vitae mattis nibh ligula nec sem duis aliquam convallis,2.1,155,standard,35.7
777,accumsan tortor quis turpis sed ante vivamus tortor duis mattis egestas,"Proin risus. Praesent lectus. Vestibulum quam sapien, varius ut, blandit non, interdum in, ante. Vestibulum ante ipsum primis in faucibus orci luctus et ultrices posuere cubilia Curae; Duis faucibus accumsan odio. Curabitur convallis.",784.23,3.61,home decor,quis orci nullam molestie nibh in lectus pellentesque at nulla suspendisse potenti cras in purus eu magna vulputate luctus,960,Purple,large,7.7,non mauris morbi non lectus aliquam sit amet diam in,2020-01-03,3.0,247,fusce congue diam id ornare imperdiet sapien urna pretium nisl ut volutpat sapien arcu sed augue aliquam erat volutpat in,3.1,390,free,24.63
778,nec condimentum neque sapien placerat ante nulla justo aliquam quis turpis eget elit sodales scelerisque mauris sit amet eros,Aliquam erat volutpat. In congue. Etiam justo. Etiam pretium iaculis justo. In hac habitasse platea dictumst. Etiam faucibus cursus urna.,963.47,6.32,electronics,montes nascetur ridiculus mus etiam vel augue vestibulum rutrum rutrum neque aenean auctor gravida,325,Crimson,small,3.5,felis eu sapien cursus vestibulum proin eu mi nulla ac enim in tempor turpis nec euismod scelerisque,2013-12-27,2.0,764,mauris eget massa tempor convallis nulla neque libero convallis eget eleifend luctus ultricies eu nibh quisque id justo sit,1.1,708,express,37.68
779,amet justo morbi ut odio cras mi pede malesuada in imperdiet et commodo vulputate justo in blandit ultrices enim,"Vestibulum ac est lacinia nisi venenatis tristique. Fusce congue, diam id ornare imperdiet, sapien urna pretium nisl, ut volutpat sapien arcu sed augue. Aliquam erat volutpat. In congue. Etiam justo.",591.21,28.42,toys,consectetuer adipiscing elit proin interdum mauris non ligula pellentesque ultrices phasellus id sapien in sapien iaculis,535,Khaki,large,7.3,faucibus cursus urna ut tellus nulla ut erat id mauris vulputate elementum nullam varius,2012-04-05,4.6,133,montes nascetur ridiculus mus etiam vel augue vestibulum rutrum rutrum neque aenean auctor,2.6,173,express,31.46
780,nulla ultrices aliquet maecenas leo odio condimentum id luctus nec molestie sed justo pellentesque viverra pede ac diam cras pellentesque,"Maecenas pulvinar lobortis est. Phasellus sit amet erat. Nulla tempus. Vivamus in felis eu sapien cursus vestibulum. Proin eu mi. Nulla ac enim. In tempor, turpis nec euismod scelerisque, quam turpis adipiscing lorem, vitae mattis nibh ligula nec sem. Duis aliquam convallis nunc.",875.19,38.25,toys,orci luctus et ultrices posuere cubilia curae nulla dapibus dolor vel est donec odio justo sollicitudin ut suscipit,666,Blue,small,5.7,sapien cursus vestibulum proin eu mi nulla ac enim in tempor turpis nec euismod scelerisque quam turpis adipiscing,2016-01-13,2.2,879,quis turpis sed ante vivamus tortor duis mattis egestas metus aenean fermentum donec,3.6,367,express,7.41
781,consectetuer eget rutrum at lorem integer tincidunt ante vel ipsum praesent blandit lacinia,Maecenas pulvinar lobortis est.,179.59,49.68,clothing,leo odio porttitor id consequat in consequat ut nulla sed accumsan felis ut at dolor quis odio,368,Purple,small,2.2,ultrices posuere cubilia curae donec pharetra magna vestibulum aliquet ultrices erat tortor sollicitudin mi sit amet lobortis sapien sapien non,2014-07-31,4.2,53,et eros vestibulum ac est lacinia nisi venenatis tristique fusce congue diam,2.1,182,free,43.61
782,in felis eu sapien cursus vestibulum proin eu mi nulla,"Aliquam quis turpis eget elit sodales scelerisque. Mauris sit amet eros. Suspendisse accumsan tortor quis turpis. Sed ante. Vivamus tortor. Duis mattis egestas metus. Aenean fermentum. Donec ut mauris eget massa tempor convallis. Nulla neque libero, convallis eget, eleifend luctus, ultricies eu, nibh.",251.42,43.4,electronics,nulla dapibus dolor vel est donec odio justo sollicitudin ut suscipit a feugiat et eros vestibulum,681,Pink,small,5.4,odio in hac habitasse platea dictumst maecenas ut massa quis augue luctus tincidunt nulla,2020-02-06,2.7,396,dui proin leo odio porttitor id consequat in consequat ut nulla sed accumsan,2.5,66,standard,15.05
783,posuere metus vitae ipsum aliquam non mauris morbi non lectus aliquam sit amet diam in magna bibendum imperdiet nullam orci,"Nunc purus. Phasellus in felis. Donec semper sapien a libero. Nam dui. Proin leo odio, porttitor id, consequat in, consequat ut, nulla. Sed accumsan felis. Ut at dolor quis odio consequat varius. Integer ac leo. Pellentesque ultrices mattis odio. Donec vitae nisi.",997.26,22.85,electronics,scelerisque quam turpis adipiscing lorem vitae mattis nibh ligula nec sem duis aliquam convallis nunc proin at turpis,52,Violet,small,5.8,nisi eu orci mauris lacinia sapien quis libero nullam sit amet turpis elementum ligula vehicula consequat morbi a ipsum,2022-04-30,3.4,441,leo maecenas pulvinar lobortis est phasellus sit amet erat nulla tempus vivamus,3.2,442,express,17.98
784,vel ipsum praesent blandit lacinia erat vestibulum sed magna at,"In blandit ultrices enim. Lorem ipsum dolor sit amet, consectetuer adipiscing elit. Proin interdum mauris non ligula pellentesque ultrices. Phasellus id sapien in sapien iaculis congue. Vivamus metus arcu, adipiscing molestie, hendrerit at, vulputate vitae, nisl. Aenean lectus.",103.32,2.82,clothing,ante vestibulum ante ipsum primis in faucibus orci luctus et ultrices posuere cubilia curae duis faucibus accumsan odio curabitur,64,Red,medium,9.8,magna at nunc commodo placerat praesent blandit nam nulla integer pede justo lacinia eget tincidunt eget tempus,2013-06-12,2.6,502,gravida sem praesent id massa id nisl venenatis lacinia aenean sit amet justo morbi,1.4,186,standard,22.38
