product_id,product_name,description,price,discount_percentage,category,brand,stock_quantity,color,size,weight,dimensions,release_date,rating,reviews_count,seller_name,seller_rating,seller_reviews_count,shipping_method,shipping_cost
501,amet nunc viverra dapibus nulla suscipit ligula in lacus curabitur at ipsum ac tellus semper interdum mauris,"Maecenas pulvinar lobortis est. Phasellus sit amet erat. Nulla tempus. Vivamus in felis eu sapien cursus vestibulum. Proin eu mi. Nulla ac enim. In tempor, turpis nec euismod scelerisque, quam turpis adipiscing lorem, vitae mattis nibh ligula nec sem. Duis aliquam convallis nunc. Proin at turpis a pede posuere nonummy.",203.64,0.15,home decor,sollicitudin ut suscipit a feugiat et eros vestibulum ac est lacinia nisi venenatis tristique fusce congue diam id,673,Purple,extra large,2.7,iaculis justo in hac habitasse platea dictumst etiam faucibus cursus urna ut tellus nulla ut erat id,2020-10-19,1.3,63,sit amet cursus id turpis integer aliquet massa id lobortis convallis tortor risus dapibus augue vel accumsan tellus nisi,2.8,167,express,8.13
502,molestie hendrerit at vulputate vitae nisl aenean lectus pellentesque eget nunc donec quis orci eget orci vehicula,"Maecenas tristique, est et tempus semper, est quam pharetra magna, ac consequat metus sapien ut nunc. Vestibulum ante ipsum primis in faucibus orci luctus et ultrices posuere cubilia Curae; Mauris viverra diam vitae quam. Suspendisse potenti. Nullam porttitor lacus at turpis. Donec posuere metus vitae ipsum. Aliquam non mauris. Morbi non lectus.",357.08,20.9,home decor,ultrices enim lorem ipsum dolor sit amet consectetuer adipiscing elit proin interdum mauris non ligula pellentesque,1000,Yellow,medium,3.6,ut ultrices vel augue vestibulum ante ipsum primis in faucibus orci luctus,2022-10-22,3.4,899,vel nisl duis ac nibh fusce lacus purus aliquet at feugiat non pretium quis lectus suspendisse potenti in eleifend,2.1,911,free,7.52
503,ipsum dolor sit amet consectetuer adipiscing elit proin risus praesent lectus vestibulum quam sapien varius ut,"Nunc rhoncus dui vel sem. Sed sagittis. Nam congue, risus semper porta volutpat, quam pede lobortis ligula, sit amet eleifend pede libero quis orci. Nullam molestie nibh in lectus. Pellentesque at nulla. Suspendisse potenti. Cras in purus eu magna vulputate luctus. Cum sociis natoque penatibus et magnis dis parturient montes, nascetur ridiculus mus.",631.29,43.1,beauty,tempus semper est quam pharetra magna ac consequat metus sapien ut nunc vestibulum ante ipsum,72,Maroon,large,3.7,cursus id turpis integer aliquet massa id lobortis convallis tortor risus,2021-12-27,4.9,785,magnis dis parturient montes nascetur ridiculus mus etiam vel augue vestibulum rutrum rutrum neque aenean auctor gravida,4.3,734,free,29.39
504,suspendisse ornare consequat lectus in est risus auctor sed tristique,"Curabitur gravida nisi at nibh. In hac habitasse platea dictumst. Aliquam augue quam, sollicitudin vitae, consectetuer eget, rutrum at, lorem. Integer tincidunt ante vel ipsum.",758.83,5.2,beauty,aliquet pulvinar sed nisl nunc rhoncus dui vel sem sed sagittis nam congue risus semper,376,Teal,medium,6.5,nunc rhoncus dui vel sem sed sagittis nam congue risus semper porta,2016-10-21,3.0,485,aliquam non mauris morbi non lectus aliquam sit amet diam in magna bibendum,2.4,74,express,2.94
505,dis parturient montes nascetur ridiculus mus vivamus vestibulum sagittis sapien cum sociis natoque penatibus et magnis,In hac habitasse platea dictumst. Maecenas ut massa quis augue luctus tincidunt.,19.42,32.67,home decor,faucibus accumsan odio curabitur convallis duis consequat dui nec nisi volutpat eleifend donec,882,Maroon,large,0.7,aliquam non mauris morbi non lectus aliquam sit amet diam in magna,2010-11-27,1.8,348,sapien cum sociis natoque penatibus et magnis dis parturient montes nascetur ridiculus mus etiam vel augue vestibulum,2.9,864,express,33.94
506,in est risus auctor sed tristique in tempus sit amet,"Aenean fermentum. Donec ut mauris eget massa tempor convallis. Nulla neque libero, convallis eget, eleifend luctus, ultricies eu, nibh. Quisque id justo sit amet sapien dignissim vestibulum. Vestibulum ante ipsum primis in faucibus orci luctus et ultrices posuere cubilia Curae; Nulla dapibus dolor vel est. Donec odio justo, sollicitudin ut, suscipit a, feugiat et, eros. Vestibulum ac est lacinia nisi venenatis tristique.",251.76,40.93,electronics,et ultrices posuere cubilia curae donec pharetra magna vestibulum aliquet ultrices erat tortor sollicitudin,615,Mauv,large,3.4,vitae consectetuer eget rutrum at lorem integer tincidunt ante vel,2011-10-03,1.3,972,pellentesque eget nunc donec quis orci eget orci vehicula condimentum curabitur in libero,3.8,73,standard,17.57
507,faucibus orci luctus et ultrices posuere cubilia curae donec pharetra magna vestibulum aliquet ultrices erat tortor sollicitudin mi,"Vestibulum rutrum rutrum neque. Aenean auctor gravida sem. Praesent id massa id nisl venenatis lacinia. Aenean sit amet justo. Morbi ut odio. Cras mi pede, malesuada in, imperdiet et, commodo vulputate, justo. In blandit ultrices enim. Lorem ipsum dolor sit amet, consectetuer adipiscing elit. Proin interdum mauris non ligula pellentesque ultrices. Phasellus id sapien in sapien iaculis congue.",392.42,7.07,home decor,sit amet nunc viverra dapibus nulla suscipit ligula in lacus curabitur at,189,Maroon,medium,4.5,lacus purus aliquet at feugiat non pretium quis lectus suspendisse,2020-07-27,3.1,77,parturient montes nascetur ridiculus mus vivamus vestibulum sagittis sapien cum sociis natoque penatibus et magnis dis parturient montes nascetur ridiculus,1.2,538,express,43.0
508,elit ac nulla sed vel enim sit amet nunc viverra dapibus nulla suscipit ligula in,"Vestibulum quam sapien, varius ut, blandit non, interdum in, ante. Vestibulum ante ipsum primis in faucibus orci luctus et ultrices posuere cubilia Curae; Duis faucibus accumsan odio. Curabitur convallis. Duis consequat dui nec nisi volutpat eleifend. Donec ut dolor. Morbi vel lectus in quam fringilla rhoncus. Mauris enim leo, rhoncus sed, vestibulum sit amet, cursus id, turpis.",997.65,0.71,home decor,penatibus et magnis dis parturient montes nascetur ridiculus mus etiam vel augue vestibulum rutrum rutrum,885,Pink,medium,5.1,id sapien in sapien iaculis congue vivamus metus arcu adipiscing,2012-05-05,3.6,839,eros elementum pellentesque quisque porta volutpat erat quisque erat eros viverra eget,1.8,149,express,45.27
509,justo maecenas rhoncus aliquam lacus morbi quis tortor id nulla ultrices aliquet maecenas leo,"Duis aliquam convallis nunc. Proin at turpis a pede posuere nonummy. Integer non velit. Donec diam neque, vestibulum eget, vulputate ut, ultrices vel, augue.",58.38,3.22,home decor,semper est quam pharetra magna ac consequat metus sapien ut nunc vestibulum ante,445,Khaki,medium,3.0,quam nec dui luctus rutrum nulla tellus in sagittis dui vel nisl duis ac nibh fusce lacus,2014-10-16,3.3,590,cubilia curae duis faucibus accumsan odio curabitur convallis duis consequat dui nec nisi volutpat eleifend donec ut dolor,4.7,518,free,23.99
510,lorem quisque ut erat curabitur gravida nisi at nibh in hac habitasse platea dictumst aliquam,"Duis bibendum, felis sed interdum venenatis, turpis enim blandit mi, in porttitor pede justo eu massa. Donec dapibus. Duis at velit eu est congue elementum. In hac habitasse platea dictumst. Morbi vestibulum, velit id pretium iaculis, diam erat fermentum justo, nec condimentum neque sapien placerat ante. Nulla justo. Aliquam quis turpis eget elit sodales scelerisque. Mauris sit amet eros. Suspendisse accumsan tortor quis turpis. Sed ante.",254.83,9.08,beauty,primis in faucibus orci luctus et ultrices posuere cubilia curae duis faucibus accumsan odio curabitur convallis,159,Khaki,large,3.6,duis at velit eu est congue elementum in hac habitasse platea dictumst morbi vestibulum,2014-02-08,4.3,962,posuere cubilia curae donec pharetra magna vestibulum aliquet ultrices erat tortor sollicitudin mi sit amet lobortis,1.9,746,standard,2.33
511,rhoncus sed vestibulum sit amet cursus id turpis integer aliquet massa id lobortis convallis tortor risus dapibus augue vel accumsan,Proin eu mi. Nulla ac enim.,702.42,9.03,beauty,felis sed lacus morbi sem mauris laoreet ut rhoncus aliquet pulvinar sed nisl nunc rhoncus dui vel sem sed sagittis,9,Red,small,1.6,sit amet sapien dignissim vestibulum vestibulum ante ipsum primis in faucibus orci,2014-03-23,2.2,517,at feugiat non pretium quis lectus suspendisse potenti in eleifend quam a odio in hac habitasse platea dictumst maecenas,4.6,69,free,33.23
512,consequat varius integer ac leo pellentesque ultrices mattis odio donec vitae nisi nam ultrices libero non mattis pulvinar nulla pede,"Quisque porta volutpat erat. Quisque erat eros, viverra eget, congue eget, semper rutrum, nulla. Nunc purus. Phasellus in felis. Donec semper sapien a libero. Nam dui.",175.23,30.11,electronics,velit donec diam neque vestibulum eget vulputate ut ultrices vel augue vestibulum ante ipsum primis in faucibus orci,541,Orange,extra large,2.3,ac neque duis bibendum morbi non quam nec dui luctus rutrum nulla,2022-02-09,4.7,510,tincidunt in leo maecenas pulvinar lobortis est phasellus sit amet erat nulla tempus vivamus in felis,1.6,139,standard,7.9
513,libero convallis eget eleifend luctus ultricies eu nibh quisque id justo,Morbi vel lectus in quam fringilla rhoncus.,143.12,26.37,home decor,convallis eget eleifend luctus ultricies eu nibh quisque id justo sit,832,Maroon,large,7.1,tincidunt lacus at velit vivamus vel nulla eget eros elementum pellentesque quisque porta volutpat erat quisque erat eros viverra eget,2016-07-06,3.9,252,ut massa volutpat convallis morbi odio odio elementum eu interdum eu tincidunt in leo maecenas pulvinar lobortis,2.2,287,free,5.37
514,consequat morbi a ipsum integer a nibh in quis justo maecenas rhoncus aliquam lacus,Proin risus. Praesent lectus.,318.47,46.88,clothing,orci luctus et ultrices posuere cubilia curae mauris viverra diam vitae quam suspendisse potenti nullam porttitor,181,Turquoise,medium,6.1,luctus tincidunt nulla mollis molestie lorem quisque ut erat curabitur gravida nisi at nibh in,2015-06-14,1.3,445,amet sapien dignissim vestibulum vestibulum ante ipsum primis in faucibus,3.7,864,standard,5.76
515,suspendisse accumsan tortor quis turpis sed ante vivamus tortor duis mattis egestas metus aenean fermentum donec,"Cum sociis natoque penatibus et magnis dis parturient montes, nascetur ridiculus mus. Etiam vel augue. Vestibulum rutrum rutrum neque. Aenean auctor gravida sem. Praesent id massa id nisl venenatis lacinia.",857.42,16.14,electronics,quis orci nullam molestie nibh in lectus pellentesque at nulla suspendisse potenti,908,Turquoise,medium,1.5,amet sem fusce consequat nulla nisl nunc nisl duis bibendum felis,2017-03-05,4.0,340,felis sed interdum venenatis turpis enim blandit mi in porttitor pede justo eu,1.9,662,free,11.69
516,ante ipsum primis in faucibus orci luctus et ultrices posuere cubilia curae,Ut at dolor quis odio consequat varius. Integer ac leo. Pellentesque ultrices mattis odio.,491.7,14.34,home decor,fusce congue diam id ornare imperdiet sapien urna pretium nisl ut volutpat sapien arcu sed augue aliquam,488,Teal,medium,4.9,bibendum morbi non quam nec dui luctus rutrum nulla tellus in sagittis dui vel nisl duis ac nibh fusce,2022-12-05,4.0,425,varius nulla facilisi cras non velit nec nisi vulputate nonummy maecenas tincidunt lacus at velit vivamus vel,4.8,282,express,2.6
517,tincidunt nulla mollis molestie lorem quisque ut erat curabitur gravida nisi at nibh in,"Morbi odio odio, elementum eu, interdum eu, tincidunt in, leo. Maecenas pulvinar lobortis est. Phasellus sit amet erat. Nulla tempus. Vivamus in felis eu sapien cursus vestibulum. Proin eu mi. Nulla ac enim.",79.83,26.91,clothing,at lorem integer tincidunt ante vel ipsum praesent blandit lacinia,580,Red,extra large,1.6,donec odio justo sollicitudin ut suscipit a feugiat et eros vestibulum ac est lacinia nisi venenatis tristique,2010-11-07,3.0,116,nulla quisque arcu libero rutrum ac lobortis vel dapibus at diam nam tristique tortor eu,3.1,978,standard,43.56
518,faucibus orci luctus et ultrices posuere cubilia curae donec pharetra magna vestibulum aliquet ultrices erat tortor,"Nulla neque libero, convallis eget, eleifend luctus, ultricies eu, nibh. Quisque id justo sit amet sapien dignissim vestibulum. Vestibulum ante ipsum primis in faucibus orci luctus et ultrices posuere cubilia Curae; Nulla dapibus dolor vel est. Donec odio justo, sollicitudin ut, suscipit a, feugiat et, eros. Vestibulum ac est lacinia nisi venenatis tristique. Fusce congue, diam id ornare imperdiet, sapien urna pretium nisl, ut volutpat sapien arcu sed augue.",352.77,0.23,toys,pede libero quis orci nullam molestie nibh in lectus pellentesque at nulla suspendisse potenti cras in purus eu,659,Khaki,small,0.7,neque vestibulum eget vulputate ut ultrices vel augue vestibulum ante ipsum primis in faucibus orci luctus et ultrices posuere,2016-08-04,2.1,687,odio in hac habitasse platea dictumst maecenas ut massa quis augue luctus tincidunt nulla mollis molestie,4.9,139,standard,11.75
519,varius ut blandit non interdum in ante vestibulum ante ipsum primis in faucibus orci luctus et ultrices posuere cubilia curae,"Nullam sit amet turpis elementum ligula vehicula consequat. Morbi a ipsum. Integer a nibh. In quis justo. Maecenas rhoncus aliquam lacus. Morbi quis tortor id nulla ultrices aliquet. Maecenas leo odio, condimentum id, luctus nec, molestie sed, justo. Pellentesque viverra pede ac diam. Cras pellentesque volutpat dui.",936.83,39.96,beauty,integer non velit donec diam neque vestibulum eget vulputate ut ultrices vel augue vestibulum ante ipsum primis,321,Goldenrod,extra large,8.2,porttitor lorem id ligula suspendisse ornare consequat lectus in est risus auctor sed tristique in,2014-11-22,2.1,506,luctus et ultrices posuere cubilia curae nulla dapibus dolor vel est donec odio justo sollicitudin ut suscipit a feugiat,1.7,953,standard,4.43
520,vestibulum sed magna at nunc commodo placerat praesent blandit nam nulla integer pede justo lacinia eget tincidunt eget tempus vel,"Quisque ut erat. Curabitur gravida nisi at nibh. In hac habitasse platea dictumst. Aliquam augue quam, sollicitudin vitae, consectetuer eget, rutrum at, lorem. Integer tincidunt ante vel ipsum. Praesent blandit lacinia erat. Vestibulum sed magna at nunc commodo placerat. Praesent blandit. Nam nulla.",639.9,47.34,beauty,sit amet lobortis sapien sapien non mi integer ac neque duis bibendum morbi non quam nec dui luctus rutrum nulla,477,Crimson,small,3.7,iaculis justo in hac habitasse platea dictumst etiam faucibus cursus urna ut tellus nulla ut,2016-04-08,4.5,209,in lacus curabitur at ipsum ac tellus semper interdum mauris ullamcorper purus,2.5,904,express,23.72
521,vitae consectetuer eget rutrum at lorem integer tincidunt ante vel ipsum praesent blandit lacinia erat vestibulum sed,"Sed vel enim sit amet nunc viverra dapibus. Nulla suscipit ligula in lacus. Curabitur at ipsum ac tellus semper interdum. Mauris ullamcorper purus sit amet nulla. Quisque arcu libero, rutrum ac, lobortis vel, dapibus at, diam.",641.81,32.81,beauty,tincidunt lacus at velit vivamus vel nulla eget eros elementum pellentesque quisque porta,281,Goldenrod,extra large,1.3,nisl duis ac nibh fusce lacus purus aliquet at feugiat non pretium quis lectus suspendisse potenti in,2015-06-25,3.5,411,cubilia curae donec pharetra magna vestibulum aliquet ultrices erat tortor sollicitudin mi sit amet lobortis sapien sapien non mi integer,4.0,101,express,36.87
522,eros suspendisse accumsan tortor quis turpis sed ante vivamus tortor duis mattis egestas,"Nam dui. Proin leo odio, porttitor id, consequat in, consequat ut, nulla.",893.49,41.93,beauty,ligula nec sem duis aliquam convallis nunc proin at turpis,895,Green,extra large,0.1,ante vel ipsum praesent blandit lacinia erat vestibulum sed magna at nunc commodo placerat praesent blandit nam,2012-01-14,4.6,410,nam nulla integer pede justo lacinia eget tincidunt eget tempus vel pede morbi porttitor lorem id ligula,2.5,982,standard,7.86
523,lacinia sapien quis libero nullam sit amet turpis elementum ligula vehicula consequat morbi a ipsum integer a nibh,Nullam varius.,226.93,49.01,clothing,vulputate ut ultrices vel augue vestibulum ante ipsum primis in faucibus orci luctus et ultrices posuere cubilia curae donec,783,Red,medium,3.4,ligula suspendisse ornare consequat lectus in est risus auctor sed tristique in tempus sit amet sem fusce consequat nulla,2013-12-03,4.6,408,sit amet consectetuer adipiscing elit proin risus praesent lectus vestibulum quam sapien varius ut blandit non interdum in,3.3,462,express,13.89
524,suspendisse potenti nullam porttitor lacus at turpis donec posuere metus vitae ipsum aliquam non mauris morbi non,"Praesent lectus. Vestibulum quam sapien, varius ut, blandit non, interdum in, ante. Vestibulum ante ipsum primis in faucibus orci luctus et ultrices posuere cubilia Curae; Duis faucibus accumsan odio. Curabitur convallis.",489.26,47.12,home decor,vitae ipsum aliquam non mauris morbi non lectus aliquam sit amet diam in magna bibendum,1000,Fuscia,extra large,8.7,luctus tincidunt nulla mollis molestie lorem quisque ut erat curabitur gravida nisi,2022-01-02,4.7,859,ut nulla sed accumsan felis ut at dolor quis odio consequat varius integer ac leo pellentesque ultrices mattis odio donec,2.8,521,free,15.98
525,pede ullamcorper augue a suscipit nulla elit ac nulla sed vel enim sit amet nunc viverra dapibus nulla,"Vivamus metus arcu, adipiscing molestie, hendrerit at, vulputate vitae, nisl. Aenean lectus. Pellentesque eget nunc. Donec quis orci eget orci vehicula condimentum. Curabitur in libero ut massa volutpat convallis. Morbi odio odio, elementum eu, interdum eu, tincidunt in, leo. Maecenas pulvinar lobortis est.",519.03,34.9,home decor,odio justo sollicitudin ut suscipit a feugiat et eros vestibulum ac est lacinia,52,Red,medium,9.5,in lectus pellentesque at nulla suspendisse potenti cras in purus eu magna vulputate luctus cum sociis natoque penatibus et magnis,2016-08-04,2.6,641,lobortis ligula sit amet eleifend pede libero quis orci nullam molestie nibh in lectus pellentesque at nulla,2.8,78,standard,24.99
526,at nunc commodo placerat praesent blandit nam nulla integer pede justo lacinia eget tincidunt eget tempus vel,Etiam pretium iaculis justo. In hac habitasse platea dictumst.,9.24,30.84,electronics,vulputate elementum nullam varius nulla facilisi cras non velit nec,666,Khaki,large,6.7,mattis egestas metus aenean fermentum donec ut mauris eget massa tempor convallis nulla neque libero convallis eget eleifend,2020-11-07,2.2,311,nulla neque libero convallis eget eleifend luctus ultricies eu nibh quisque id justo sit amet sapien dignissim vestibulum,3.4,835,free,2.49
527,dui nec nisi volutpat eleifend donec ut dolor morbi vel lectus in quam fringilla rhoncus mauris enim leo,"Duis at velit eu est congue elementum. In hac habitasse platea dictumst. Morbi vestibulum, velit id pretium iaculis, diam erat fermentum justo, nec condimentum neque sapien placerat ante. Nulla justo. Aliquam quis turpis eget elit sodales scelerisque. Mauris sit amet eros. Suspendisse accumsan tortor quis turpis.",593.01,20.61,toys,libero convallis eget eleifend luctus ultricies eu nibh quisque id justo sit amet sapien dignissim vestibulum vestibulum ante,964,Mauv,small,2.6,magnis dis parturient montes nascetur ridiculus mus etiam vel augue vestibulum,2014-03-22,2.4,835,quam fringilla rhoncus mauris enim leo rhoncus sed vestibulum sit amet cursus id turpis integer aliquet massa id,3.5,605,express,31.83
528,turpis enim blandit mi in porttitor pede justo eu massa donec dapibus duis at velit eu est congue elementum in,"Donec semper sapien a libero. Nam dui. Proin leo odio, porttitor id, consequat in, consequat ut, nulla. Sed accumsan felis. Ut at dolor quis odio consequat varius. Integer ac leo. Pellentesque ultrices mattis odio. Donec vitae nisi. Nam ultrices, libero non mattis pulvinar, nulla pede ullamcorper augue, a suscipit nulla elit ac nulla. Sed vel enim sit amet nunc viverra dapibus.",303.51,25.33,electronics,in purus eu magna vulputate luctus cum sociis natoque penatibus et magnis dis parturient,72,Green,medium,8.7,nulla ultrices aliquet maecenas leo odio condimentum id luctus nec molestie sed justo pellentesque viverra pede,2021-08-21,1.6,907,lorem integer tincidunt ante vel ipsum praesent blandit lacinia erat vestibulum sed magna at nunc commodo,2.7,10,express,1.19
529,platea dictumst etiam faucibus cursus urna ut tellus nulla ut erat id mauris vulputate elementum nullam varius nulla facilisi,Morbi porttitor lorem id ligula. Suspendisse ornare consequat lectus.,238.28,0.88,beauty,pretium iaculis diam erat fermentum justo nec condimentum neque sapien placerat ante nulla justo aliquam quis turpis,725,Aquamarine,medium,6.8,elit proin risus praesent lectus vestibulum quam sapien varius ut blandit non interdum in,2017-03-17,3.1,593,at vulputate vitae nisl aenean lectus pellentesque eget nunc donec quis orci eget orci vehicula condimentum curabitur in libero,2.2,1000,standard,14.9
530,penatibus et magnis dis parturient montes nascetur ridiculus mus etiam vel,"Aliquam quis turpis eget elit sodales scelerisque. Mauris sit amet eros. Suspendisse accumsan tortor quis turpis. Sed ante. Vivamus tortor. Duis mattis egestas metus. Aenean fermentum. Donec ut mauris eget massa tempor convallis. Nulla neque libero, convallis eget, eleifend luctus, ultricies eu, nibh. Quisque id justo sit amet sapien dignissim vestibulum.",421.76,25.61,home decor,et tempus semper est quam pharetra magna ac consequat metus sapien ut nunc vestibulum ante,152,Pink,medium,2.4,ac neque duis bibendum morbi non quam nec dui luctus rutrum nulla tellus in sagittis dui vel nisl,2013-06-02,1.2,826,etiam pretium iaculis justo in hac habitasse platea dictumst etiam faucibus cursus,1.3,991,standard,9.46
531,morbi non quam nec dui luctus rutrum nulla tellus in sagittis dui vel nisl duis ac nibh fusce,Nullam molestie nibh in lectus.,872.46,18.59,home decor,cras in purus eu magna vulputate luctus cum sociis natoque penatibus et magnis dis parturient montes nascetur,189,Pink,large,5.4,odio elementum eu interdum eu tincidunt in leo maecenas pulvinar lobortis est phasellus sit amet erat nulla tempus,2016-03-29,2.0,829,orci pede venenatis non sodales sed tincidunt eu felis fusce posuere felis sed lacus morbi sem mauris laoreet,3.7,861,standard,29.49
532,ut blandit non interdum in ante vestibulum ante ipsum primis in faucibus orci luctus et ultrices posuere cubilia curae,"Nam dui. Proin leo odio, porttitor id, consequat in, consequat ut, nulla.",242.68,24.86,toys,risus auctor sed tristique in tempus sit amet sem fusce consequat nulla nisl nunc nisl duis bibendum felis,912,Fuscia,medium,1.7,ligula pellentesque ultrices phasellus id sapien in sapien iaculis congue vivamus,2017-11-11,3.3,24,massa donec dapibus duis at velit eu est congue elementum in hac habitasse platea dictumst morbi,4.8,660,express,2.3
533,fusce lacus purus aliquet at feugiat non pretium quis lectus suspendisse potenti in eleifend quam a odio,"Nullam orci pede, venenatis non, sodales sed, tincidunt eu, felis. Fusce posuere felis sed lacus. Morbi sem mauris, laoreet ut, rhoncus aliquet, pulvinar sed, nisl. Nunc rhoncus dui vel sem. Sed sagittis. Nam congue, risus semper porta volutpat, quam pede lobortis ligula, sit amet eleifend pede libero quis orci. Nullam molestie nibh in lectus. Pellentesque at nulla. Suspendisse potenti.",570.71,37.61,clothing,nisi volutpat eleifend donec ut dolor morbi vel lectus in quam fringilla rhoncus mauris enim leo rhoncus,264,Mauv,large,1.6,lectus pellentesque at nulla suspendisse potenti cras in purus eu magna vulputate luctus cum sociis natoque penatibus,2011-02-17,3.9,376,in hac habitasse platea dictumst morbi vestibulum velit id pretium iaculis diam erat fermentum justo nec condimentum neque,4.8,108,free,9.98
534,imperdiet nullam orci pede venenatis non sodales sed tincidunt eu felis fusce posuere felis sed lacus morbi,Mauris sit amet eros. Suspendisse accumsan tortor quis turpis. Sed ante. Vivamus tortor.,961.47,10.07,electronics,vivamus vel nulla eget eros elementum pellentesque quisque porta volutpat erat quisque erat eros viverra,342,Maroon,medium,3.2,elit ac nulla sed vel enim sit amet nunc viverra dapibus nulla suscipit ligula in lacus curabitur at,2020-11-22,1.6,235,nisl nunc nisl duis bibendum felis sed interdum venenatis turpis enim blandit mi in porttitor,4.9,134,express,24.29
535,risus semper porta volutpat quam pede lobortis ligula sit amet eleifend pede libero quis orci nullam,"Proin interdum mauris non ligula pellentesque ultrices. Phasellus id sapien in sapien iaculis congue. Vivamus metus arcu, adipiscing molestie, hendrerit at, vulputate vitae, nisl.",288.88,18.8,toys,nibh ligula nec sem duis aliquam convallis nunc proin at turpis a pede posuere,196,Crimson,medium,0.4,aliquam quis turpis eget elit sodales scelerisque mauris sit amet eros suspendisse accumsan tortor quis turpis sed ante,2017-10-19,4.0,675,vitae nisi nam ultrices libero non mattis pulvinar nulla pede,4.1,298,standard,6.81
